{"fileCount":7,"files":[{"digest":"sha256:a948904f2f0f479b8f8197694b30184b0d2ed1c1cd2a1ec0fb85d299a192a447","mode":420,"path":"README.md","size":12},{"digest":"sha256:37b128c59f1f5097f73f82691cb519f1f568667faab5ced1b4ab979d36837eae","mode":420,"path":"app/config/service.yaml","size":5},{"digest":"sha256:32cdc60fcdee258711907d805fbfc8d51129a378e45be23d7ef5a58c20ba03ef","mode":493,"path":"app/scripts/run.sh","size":12},{"digest":"sha256:c5dbae22661af6db18a1f676db82a7ef7de46d27c3a263a872f00478b0d99fc4","mode":420,"path":"binary.dat","size":4},{"digest":"sha256:999e3bbc8148d63317b843359835fa52a58c5a0a71fa8e0685254c28c43cbbcb","mode":420,"path":"café/naïve.txt","size":3},{"digest":"sha256:74611c1d6455b534323a21f8133a6f43dc3a8188e7b946f96dcc28dde932fcb2","mode":420,"path":"directory/directory/directory/directory/directory/directory/directory/directory/directory/directory/directory/directory/deep.txt","size":4},{"digest":"sha256:e3b0c44298fc1c149afbf4c8996fb92427ae41e4649b934ca495991b7852b855","mode":420,"path":"empty","size":0}],"format":"devproof-bundle-v1","schemaVersion":1,"totalSize":40,"treeDigest":"sha256:41aa490df031f29ba4503918068c7c2da05da513f187ae1626954cc0e58b406b"}